"name","nickname","birthday","gender","country","influence","info","talent.name","talent.doc","talent.certification","cv.cn","cv.jp","cv.ko","cv.en","stories.0.title","stories.0.content","stories.1.title","stories.1.content","stories.2.title","stories.2.content","stories.3.title","stories.3.content","stories.4.title","stories.4.content","goods.0.title","goods.0.content","goods.1.title","goods.1.content","goods.2.title","goods.2.content","voice.0.title","voice.0.content","voice.1.title","voice.1.content","voice.2.title","voice.2.content","voice.3.title","voice.3.content","voice.4.title","voice.4.content","voice.5.title","voice.5.content","voice.6.title","voice.6.content","voice.7.title","voice.7.content","voice.8.title","voice.8.content","voice.9.title","voice.9.content","voice.10.title","voice.10.content","voice.11.title","voice.11.content","voice.12.title","voice.12.content","voice.13.title","voice.13.content","voice.14.title","voice.14.content","voice.15.title","voice.15.content","voice.16.title","voice.16.content","voice.17.title","voice.17.content","voice.18.title","voice.18.content","voice.19.title","voice.19.content","voice.20.title","voice.20.content","voice.21.title","voice.21.content","voice.22.title","voice.22.content","voice.23.title","voice.23.content","voice.24.title","voice.24.content","voice.25.title","voice.25.content","voice.26.title","voice.26.content","voice.27.title","voice.27.content","voice.28.title","voice.28.content","voice.29.title","voice.29.content","voice.30.title","voice.30.content","voice.31.title","voice.31.content","voice.32.title","voice.32.content","voice.33.title","voice.33.content","voice.34.title","voice.34.content","voice.35.title","voice.35.content","voice.36.title","voice.36.content","voice.37.title","voice.37.content","voice.38.title","voice.38.content","voice.39.title","voice.39.content","voice.40.title","voice.40.content","voice.41.title","voice.41.content","voice.42.title","voice.42.content","voice.43.title","voice.43.content","voice.44.title","voice.44.content","voice.45.title","voice.45.content","voice.46.title","voice.46.content","voice.47.title","voice.47.content","voice.48.title","voice.48.content","voice.49.title","voice.49.content","voice.50.title","voice.50.content","voice.51.title","voice.51.content","voice.52.title","voice.52.content","voice.53.title","voice.53.content","voice.54.title","voice.54.content","voice.55.title","voice.55.content","voice.56.title","voice.56.content","voice.57.title","voice.57.content","voice.58.title","voice.58.content","voice.59.title","voice.59.content","voice.60.title","voice.60.content","voice.61.title","voice.61.content","voice.62.title","voice.62.content","voice.63.title","voice.63.content","voice.64.title","voice.64.content","voice.65.title","voice.65.content","voice.66.title","voice.66.content","voice.67.title","voice.67.content","voice.68.title","voice.68.content","voice.69.title","voice.69.content","voice.70.title","voice.70.content","stories","goods","voice.71.title","voice.71.content","voice.72.title","voice.72.content","voice.73.title","voice.73.content","voice.74.title","voice.74.content","voice.75.title","voice.75.content","voice.76.title","voice.76.content","voice.77.title","voice.77.content","voice.78.title","voice.78.content","voice.79.title","voice.79.content"
"Yangyang","Breath of Winds","October 11th","Female","Huanglong","Jinzhou","Yangyang is an Outrider of the Midnight Rangers.
Once sheltered, now a fighter. She soars with the wind to protect others, like a skylark in flight.","Breath of Winds","Evaluation Basis: [Resonance Assessment 1011-G]

The exact time and cause of Resonator Yangyang's Awakening remain unclear. Resonator Yangyang reports heightened sensitivity to her surroundings since her childhood.

The Tacet Mark of Resonator Yangyang is located in the center of her forehead. Post-Awakening observations found no notable physical change. As frequency fluctuations resurge, limited feather-like transformation have been observed on the ends of her hair.

Resonator Yangyang synchronizes with surrounding air by detecting information in air streams and creating an energy field using converging airflow.

The Resonance Spectrum Pattern of Resonator Yangyang displays over 20% resemblance to that of airflow and smaller bird species. While a strong Syntony reaction is present, the pattern also shares over 5% similarity with multiple other existing samples, indicating potential multiple or contaminating causes of Awakening.

Analysis of test samples has revealed a non-convergent Rabelle's Curve with a stable rise. Occasional fluctuations within the normal range have been detected. Therefore, Yangyang is identified as a Natural Resonator.","The waveform graph for Resonator Yangyang displays stable elliptical fluctuations in the Time Domain with no abnormal patterns. Upon examination, all results fall within normal parameters. 
In terms of Resonant Criticality, Resonator Yangyang ranks at a relatively low level with high stability. Examination results appear to fall within normal parameters with no risk of Overclocking. 
Resonator Yangyang has a documented history of Overclocking. 
Maximum recorded Overclocking rating: Negligible.
During the event, Resonator Yangyang experienced emotional overflow and temporary loss of Forte control. Fortunately, there were no casualties or hazards reported, though she suffered several comatose episodes due to the overstimulation. Further examination revealed that Yangyang's heightened perception was causing harm to her body through her Forte. The aftereffects have since stabilized, but the feather-like transformation on the ends of her hair remains irreversible. Yangyang's sensory overload has been managed and her emotional state is stable, with a positive prognosis. Routine examinations are recommended for monitoring purposes.","VA: Jen Zhang","VA: Ishikawa Yui","VA: Lee Yoo Ri","VA: Rebecca Yeo","The Secret to Excellence","In any social group, there are those who exude a convincing, reliable aura that convinces people they could achieve anything, despite not having started or done it before. 

Yangyang is one such person.

""Yangyang? It seems... She can do everything so well."" People would always say so. This trust probably stems from their experiences with her. 

Since childhood, Yangyang has excelled in her studies, including etiquette, music, literature, mathematics, and martial arts... She always ranked at the top in all subjects and exams every year. Even when encountering new knowledge or difficult problems, Yangyang never showed frustration; rather, she would actively try to solve any problem that came her way.

Yangyang was always chosen to give speeches at her school’s annual ceremonies. But, like everyone else, she would take a deep breath before speaking, hiding her nerves. Despite having some talent for understanding complex concepts, she lacked true genius. And while others may see her as successful and confident, she struggles just as much with everyday problems.

In her first swordsmanship lesson, she struggled to control her swings and execute proper techniques. Despite this setback, she resolved to work even harder. For the next two months, she practiced 100 times a day and sought guidance from experienced seniors, humbly acknowledging her weaknesses. She then continued to practice with a reflective mindset, improving upon the deficiencies pointed out by others. Eventually, her muscles adapted to the pain and she could withstand several strikes from an opponent.

And in another two months, Yangyang, once again, emerged as the top student in her swordsmanship class.

Concerned individuals tried to console Yangyang, reminding her that life is not perfect and that she should be content with the affirmation and praise she receives. But Yangyang would kindly reject this advice, knowing that her drive came from within and not from seeking validation from others. 

Was she giving her all? Was everything done to the best of her ability? These were the questions that consumed her. 

With a smile and a gentle shake of her head, she would reject any advice to take it easy, determined to push herself to perfection with no room for regrets or shame.

""That's our Yangyang, doing amazing as always. We knew you'd make it!"" 

That was when Yangyang became an Outrider and successfully helped resolve a regional TD crisis. People praised her excellence as usual.

""Yes, I did it this time, but how about next time? There are still so many things I could have done better; so many things I don't know. Perhaps I should go seek advice from senior members of the Midnight Ranger...""

Being consistently reliable is daunting, yet crucial. It takes relentless effort and dedication.

Yangyang is determined to give her all to achieve this goal. She strives to be the one others can seek help from anytime, and won’t stop until she succeeds.","The Secret to Listening","Most people didn't know that Yangyang had a perfect pitch. 

Perhaps it was because how she was always a passive presence, never singing in public or taking the spotlight. She preferred to stay in the background and listen. It seemed like she was born to be a listener.

That's why Chixia was shocked at Yangyang's ability to accurately hum a melody she had only heard. She couldn't help but exclaim, ""How did you memorize that so fast? And it sounded amazing! Good heavens!""

Suddenly, everyone remembered Yangyang's other identity, the second daughter of a family of music. It would be only unnatural if she didn't understand music theory or know how to sing. 

This revelation resolved some of the previous confusion. That perfect way of dealing with people, that etiquette which seemed faultless to even the most demanding people. Yes, of course, she had to come from such a well-educated family. 

However, it also begged another question: Why would the daughter of such a renowned family go to the border city alone, at the expense of her otherwise luxurious life and promising career? Was there an underlying reason that compelled her to leave? 

If there really was such a reason, Yangyang never mentioned it to anyone. She never complained or avoided responsibilities, whether when she fulfilled her Outrider responsibilities, or when she spent time with friends. If one had to say, it was her Outrider companions that bothered her more, because... She was always patiently lending an ear.

Many sought solace in confiding to Yangyang, not seeking solutions but simply venting their stress. She knew this well and remained neutral, empathizing with the narrator's feelings. She listened without interruption, offering guidance when needed before returning to a silent role. With her help, the tangled emotions were untangled unnoticed. These cathartic sessions proved valuable. However, Yangyang's support was not blind agreement; she offered advice prioritizing the speaker's desires.

Soon enough, Chixia told everyone else about Yangyang's amazing talent, sparking playful requests for a song.
Yangyang shyly waved off their request, saying, “Maybe... I'll sing it for everyone later, when I am ready?” 

Yangyang looked sincere, so it seemed not just perfunctory or an excuse. It was truly what she thought from the bottom of her heart. But when would that be? Perhaps she wanted to wait until everyone else who wanted her to hear out their worries had finished talking?

Understanding and critiquing performances requires a deep knowledge of music. 
However, being skilled in music does not necessitate taking the stage. 

So thought Yangyang, as she again chose to step back, allowing others to shine.","The Secret to Believing","To some extent, there isn't much difference between the sixteen-year-old Yangyang and the six-year-old Yangyang.

She still holds the same expectations for the world, believing in fairy tales as always, believing in the goodness between people, believing in miracles, believing that all things beautiful will eventually happen.

Many would call this naive luck, the thoughts of a spoiled child who has never faced the harsh realities of life.

Indeed, Yangyang grew up in a privileged and nurturing home, shielded from suffering. Her life was perfect...

...Until that fateful day.

At age 11, her tranquil life was shattered by a ruthless attack from Exiles while traveling with her family’s caravan. The brutal reality of death and cruelty left her reeling as she fled and sought refuge among strangers in an unfamiliar settlement. These resilient people lived off the land, cautious yet resourceful. She was forced to fend for herself, adapting to this harsh new world at a young age. She couldn’t tell if they were like the ruthless attackers or not. The constant alertness of these settlers made her question if it was safe to trust anyone. Dressed in fine clothes and alone, she stood out among them, and they too were suspicious of her. Could it be a trap?

In the end, they passed food to her, and she took it, though she'd never seen anything like it.

Kindness found its roots even in the most barren of lands. Yangyang wanted to repay the trust they released before her, but her knowledge proved not helpful at all in the wild, and her sword skills proved too childish against real hostility. Everything seemed entirely unfamiliar to her, yet this was the harsh reality most people had to face. The reality felt so overwhelmingly agonizing.

""Grandma, have you... been living like this all the time?"" As Yangyang tried to help an old lady sort out the meager resources they had, she couldn't help but ask this abrupt question.

""Yes, why? City girl. You shocked? Relax. Everything will be fine.""

""But when? Will things really be fine one day?""

""Of course. How will good things come true if you don't even believe them yourself? We were skeptical of you, too, but we chose to believe. It's the same for you. Gotta have faith in something in life. Even if you don't know how it'll turn out. That's what faith is all about.""

""When? Hm, maybe when you grow up, little one.""

So yes, perhaps Yangyang hasn't experienced enough hardship yet. Or maybe one's inclination to show kindness isn't based on past experiences, but inherent in their character.

In the darkest of situations, some will show kindness simply because others choose to trust them. And this in turn will spark more acts of goodwill.

Ever since, Yangyang always spread kindness to strangers, sparked by that one encounter.

Of course, her kindness is not without boundaries. Betrayal can turn her warm breeze into a harsh storm.

But she holds onto hope, believing in the power of goodness. She chooses to trust and expects the best from others. This is her chosen way to make the world a better place.","What Wind Taught Her","Yangyang had fallen into the winds three times.

The first time was when she fell from her mother's arms.

Shortly after Yangyang's birth, she was already surrounded by love. Her mother playfully swung her in her arms, pretending she was flying and landing. 

But when the swing went a little too high, Yangyang felt the whispers of wind and sensed an approaching storm, even before she could speak. As she landed, her babbling was mistaken for fear from the accident, but it was actually a reaction to the oncoming tempest.

The second time was when she passed out from sensory overload.

As she grew up, Yangyang's once vague sensing ability strengthened, allowing her to feel intangible airstreams in her palms. She called them the ""Streams,"" and they gave her insights into energy fluctuations, anomalies, and even the smallest physical details of a person. 

Trapped in a self-destructive cycle, Yangyang yearned to explore her ability and gain more insight. But the more she tried to be thorough, the deeper she fell into a maze of details.

What followed cannot be called a fall, for it was a descent through time, not space. The sensory overload lasted for months, between faintness and sobriety. Yangyang felt as light as a feather caught in a raging storm, perpetually falling.

""I must focus on the key details within my reach, rather than trying to capture everything..."" Finally, Yangyang pulled herself out of the never-ending free fall and safely landed.

The third, but maybe not the last time, was when Yangyang leaped up and threw herself into the winds.

The continual sensory overload altered her hair and taught Yangyang to tolerate the discomfort. Despite the Streams' excessive information, the recipient could sift through and extract crucial details. Signs of a struggle at the disappearance site, unusual fluctuations outside the city, and a steady rise in energy reactions...

Yangyang had never used her ability in such a dire situation, but her determination to help overrode any hesitation. The Streams surged, forming a distinct line that led to a missing child, being chased by TDs and teetering on the edge of a cliff. Without hesitation, Yangyang leaped towards the precarious figure, outstretching her hand to save the child.

Feathers danced in the air, carrying Yangyang and the child in a gentle yet powerful wind. The child looked around at the floating feathers and asked, “Are you the lark fairy that flies in the wind, miss?” 

Lost in memories, Yangyang smiled. She thought of the times when she fell into the winds, again and again. Perhaps she truly was one with the winds.","Answer Lies in the Winds","On her journey away from home, Yangyang met two kinds of people.

The first kind always seemed in such haste, yet remained unsure where they were heading, and often ended up lost and returned in regret. The other kind always had a clear destination in mind. They always made it finally, despite arduous roads and occasional stumbles. Yangyang held up her head and looked at Jinzhou city on the horizon, unsure if she could be considered one of the second kind of people. Once again, she thought of the term ""One Instrument for Life.""

""One Instrument for Life."" That is the most important principle in Yangyang's family teachings. Originally, it meant that every family member could strive to excel in everything, but they must choose one musical instrument to specialize in and practice continuously throughout their life to become a master. As circumstances changed, the principle gradually evolved into dedicating one's entire life to one pursuit, striving for excellence to make this life worthwhile.

Her mother's Instrument was composing. Yangyang had seen people dancing to her mother's songs. On the other hand, Yangyang's sister was already a successful figure in the chamber of commerce.

However, Yangyang could not easily decide on her own Instrument as they once did. What was the thing worthy of dedicating her life to? What person should she be?

She turned to her mother for help: Mother, do you want me to inherit the family business? Or, what do you want me to do? I can try anything and I will strive for excellence. Although life is full of infinite possibilities, in the end, we can only choose one path, right?

Her mother looked at her with love and said, my child, it is precisely because of this that you should not seek answers from me, but rather ask your own heart. This is a difficult question, but you need not rush an answer.

And so, Yangyang held onto her question, waiting patiently for an answer that seemed to elude her. She waited through her returning home from the desolate settlement, through the climbing out of an abyss, and through growing weary of her family's overprotectiveness. Her desire to join the world and experience its harshness grew stronger, no longer content with being a mere leaf drifting in the wind. She longed to bear the weight of reality, instead of hiding away from it.

That was when a sudden ambush in the wilderness resulted in heavy casualties from Tacet Discord attacks on the frontline. News of this tragedy quickly spread through the city, igniting feelings of sorrow, anger, and despair among its inhabitants. Emotions boiled over, with people gathered around a bonfire. Tears flowed freely, hoarse cries echoed through the night. But by morning, grief became a luxury as life returned to normal. 

Yangyang stood among them, tears streaming down her face. She hadn’t experienced any personal loss, but witnessing their sorrow and the joy of the rescued children stirred something inside her. It was a transformative moment, as she realized her true calling: to protect others, just as she had been protected before. She wanted to shield them from misfortune and give them hope for a brighter future.

As Yangyang stood at the edge of Jinzhou on her enrollment night as an Outrider, she gazed at the sky and the bustling residents below. Doubt crept in as she questioned her ability to protect these lively citizens, a responsibility she had always dreamed of fulfilling.

The Streams came from afar and gently held Yangyang in their embrace, dispelling her last bits of doubt.

They silently whispered: Jinzhou is the place. It is the destination for Yangyang the wealthy daughter, and the beginning of her journey as Yangyang the Outrider.","Striped Ribbon","Yangyang's blue beret always has a delicate ribbon attached to its brim. It's her signature look, and a precious gift from her mother before she embarked on her journey.   
To Yangyang, it symbolizes her mother's blessing and marks the start of her own journey. She holds onto the resolution she made when putting on the ribbon, determined to see it through until the end.","Sound Recorder","As Yangyang grew accustomed to the constant presence of Streams, she began to contemplate capturing the fleeting sound of the wind. With the help of Baizhi's modifications and innovative energy conversion technology, a device was created to store the Streams as visual and tangible information. Whether it be the gentle sound of snow falling on a mountain, an untold story, or a poignant moment that brings tears to one's eyes, Yangyang now had the ability to record these realities that her senses were attuned to.","All in One","Yangyang has been crafting wind chimes since she was a child, using polished jade crystals in the shape of birds as plectrums. Starting with just a few, she has now collected and gifted dozens of them to her loved ones. Each one is different, with intricate designs that evolve over time as Yangyang adds new plectrums and adjusts their placement. She sees it as a never-ending journey, with endless possibilities for interpretation. Despite not knowing what kind of melody the wind chimes will eventually create, Yangyang stays true to her original intention—a lifelong pursuit of perfecting her craft, just like her family's tradition of ""One Instrument for Life.""","Thoughts: I","If anything feels unfamiliar or unaccommodating, you can always ask me for help, Rover. This isn't only because you are our guest. It's just... you have no memory or any friends here in Jinzhou. I think there might be moments when you'd need me.","Thoughts: II","Since I became an Outrider, I've met people from all walks of life in the wild. Some always seemed in such haste, yet remained unsure where they were heading, and often ended up lost. On the other hand, those who had a clear destination in mind usually did make it, despite arduous roads and occasional stumbles. I aspire to be one of the latter, and leaving home for Jinzhou was the first step I took.","Thoughts: III","I've been able to hear what the Streams have to tell me for as long as I can remember. They are not sounds produced by the vibrations of air, nor sentences spoken in any known language. They are signals carried by the wind, tangible to me whenever I focus myself to feel those incorporeal, rippling airstreams. The wind that flowed beside my ears just whispered another spellbinding story. Do you wish to hear it?","Thoughts: IV","The Streams make an unusual ripple whenever they flow beside you, as if they are being drawn to you once they come close. I don't know what that implies, but I'm sure I won't settle for standing aside and watching, no matter the implications. If circumstances permit, I want to face everything with you.","Thoughts: V","Call my name whenever you need me. From desolate lands to vibrant cities, from the beginning prologue to the final epilogue... no matter what awaits us in the end of this journey, no matter what kind of storm you are about to bring, I want to witness everything with you, as long as you'd let me.","Yangyang's Hobby","Songs are resonating thoughts from the bottom of our hearts. They represent a person's truest feelings.","Yangyang's Trouble","I want to do as much as I can for everyone in need, but if I take on more than I can handle... I guess it would only trouble those on the receiving end of my help, and burden me further.","Favorite Food","Wuthercake is a national dish in Huanglong, though how it is made varies depending on the region. They make delicious Wuthercakes here in Jinzhou, but for me, homemade Wuthercakes are always the best. When we have the chance, would you come home with me, and have a taste of my mother's Wuthercakes?","Disliked Food","Shouldn't we cherish all food and not let any go to waste? Oh... Well, if it's truly badly cooked, then.. uhm...","Ideals","We all have an appreciation for beauty, but life isn't always full of it. I don't want to always rely on the comforts and safety others provide me with. I must be brave to face the ugly truth. I must be one that guards and gives.","Chat: I","Interested in my ribbon? It's a farewell gift from my mother back when I left for Jinzhou. I consider it a sign of a new chapter in my life, one which symbolizes rebirth. I hope it will continue to remind me I should always follow my heart.","Chat: II","My senses are sharper than most, though it used to cause me severe distress. Various stimuli seemed to come at me from all directions, slamming into my mind at once. I felt like a lone feather, tossed around in a wild storm. Don't worry... I am okay now. I have found a way to stabilize myself in the Streams, and it was the Stream's message that led me to you.","About Jiyan","On the dangerous frontiers where we suffered immense losses, it was General Jiyan who stepped up to protect everyone, making all the tough decisions to ensure our safety. As the backbone of the Midnight Rangers, he has led us to countless victories as our Qingloong. The weight on his shoulders is beyond our imagination.","About Chixia","""When in trouble, ask Chixia, the Ally of Justice!"" This statement, while playful, rings very true. With her surging passion, seasoned prowess, and abundant vigor, Chixia already meets every quality a hero should have, helping the people in need.","About Baizhi","Baizhi has a unique approach to comprehending and accomplishing tasks, but that doesn't make her a difficult person to talk to. When you ask her for help, you may notice a flicker of surprise on her face, but you will never receive a refusal.","About Danjin","I met Danjin a few times on different occasions. I could tell how much she values justice. She is very clear about when to unsheath her blade, and for what she fights, despite being surprisingly young. Her actions reflect her belief in an ideal world—one that she is determined to create.","About Taoqi","Ms. Taoqi is always gracefully poised. She is the kind of person to quickly produce multiple solutions with ease in the most urgent situations, with a smile on her face: ""Don't worry. I've got it sorted."" Her seemingly unhurried demeanor must have been earned through hard work that we don't know about.","Birthday Wishes","Today is very special. It's your big day. So... *clears throat* happy birthday to you, happy birthday to you, happy birthday to you... Rover, I hope I can sing for you on your birthday this year, then your next birthday, and then the birthday after your next birthday.","Idle: I","Buoyant and languid... where will the wind take you?","Idle: II","♪~♪...","Idle: III","With every meeting... comes the inevitable parting. Let's not dwell on it.","Self-Introduction","I am Yangyang, a temporary Outrider of the Midnight Rangers, responsible for detecting and investigating anomalies. The Streams have guided me to you. I have a feeling we'll be companions for many moons to come.","Greeting","The Streams have guided me to you. I have a feeling we'll be companions for many moons to come.","Join Team: I","Let's reach farther destinations together.","Join Team: II","The skylark's song is about to sound.","Join Team: III","I will do my best to help everyone.","Ascension: I","The Streams are getting louder. What do they have to tell me?","Ascension: II","I've never felt such strength in me. It's all thanks to you, isn't it? I am forever grateful, Rover, for everything you've done for me.","Ascension: III","Streams are converging from all sides, and I stand in their midst, expecting the wind's arrival.","Ascension: IV","I dedicate my song to brilliance, braving the raging storm. The skylark in me has never soared higher into the heavens.","Ascension: V","This is it... Rover, you have already done so much for me, I shouldn't ask for more. From now on, I want to be the one taking care of you. Please... will you let me? I hope I can be the one to embrace all that you are, and share with you all that you carry.","Aerial Attack","Tempest.","Resonance Skill: I","Precipitance.","Resonance Skill: II","Serenade.","Resonance Skill: III","Deference.","Resonance Liberation: I","Storm, hear my command.","Resonance Liberation: II","Let the winds roar.","Resonance Liberation: III","Shape the shapeless.","Hit: I","*Effort Sound*","Hit: II","Ugh...I'm okay.","Hit: III","Doesn't... matter.","Injured: I","Don't worry.","Injured: II","I can... take it.","Injured: III","I should... Give it my all...","Fallen: I","The wind... has stopped.","Fallen: II","Sorry, I didn't...","Fallen: III","Is this it... for me...","Echo Summon","Please.","Echo Transform","Synchronization.","Intro & Outro Skills","Let me be your blade.","Glider","Against the winds.","Grapple","*Effort Sound*","Sensor","Shall we take a look?","Dash","Speeding up.","Wall Dash","Winds, lift me.","Supply Chest: I","Something you need?","Supply Chest: II","This is the answer to our endeavor.","Supply Chest: III","This should suffice for a while.",,,,,,,,,,,,,,,,,,,,,,,,,,,,,,,,,,,,,,,,,,,,,,
